{
  "$schema": "https://json-schema.org/draft/2020-12/schema",
  "$id": "https://evemisslab.com/schemas/ctcl-itr/calibration-joint-surface-spec-v0.2.11.json",
  "title": "CTCL-ITR Calibration Joint Surface Spec v0.2.11",
  "type": "object",
  "additionalProperties": false,
  "required": ["schema_version", "surface_id", "generated_at", "method", "resampling", "mixture_grid"],
  "properties": {
    "schema_version": {"const": "0.2.11"},
    "surface_id": {"type": "string", "minLength": 1},
    "generated_at": {"type": "string", "format": "date-time"},
    "method": {"const": "joint_empirical_binomial_simplex_surface_v1"},
    "resampling": {
      "type": "object",
      "additionalProperties": false,
      "required": ["method", "seed", "replicates", "interval_p", "minimum_supported_fraction"],
      "properties": {
        "method": {"const": "stratified_empirical_binomial_sha256_v1"},
        "seed": {"type": "string", "minLength": 1},
        "replicates": {"type": "integer", "minimum": 1},
        "interval_p": {"type": "number", "exclusiveMinimum": 0, "maximum": 1},
        "minimum_supported_fraction": {"type": "number", "exclusiveMinimum": 0, "maximum": 1}
      }
    },
    "mixture_grid": {
      "type": "object",
      "additionalProperties": false,
      "required": ["method", "grid_step", "minimum_family_weight", "max_grid_points"],
      "properties": {
        "method": {"const": "simplex_grid_reference_mixture_v1"},
        "grid_step": {"type": "number", "exclusiveMinimum": 0, "exclusiveMaximum": 1},
        "minimum_family_weight": {"type": "number", "exclusiveMinimum": 0, "exclusiveMaximum": 1},
        "max_grid_points": {"type": "integer", "minimum": 1}
      }
    }
  }
}
