{
  "schema_version": "0.2.11",
  "surface_id": "surface:reference-base-current",
  "generated_at": "2026-08-23T03:55:00+08:00",
  "method": "joint_empirical_binomial_simplex_surface_v1",
  "resampling": {
    "method": "stratified_empirical_binomial_sha256_v1",
    "seed": "ctcl-itr-v0.2.11-reference-20260823",
    "replicates": 256,
    "interval_p": 0.9,
    "minimum_supported_fraction": 0.5
  },
  "mixture_grid": {
    "method": "simplex_grid_reference_mixture_v1",
    "grid_step": 0.1,
    "minimum_family_weight": 0.1,
    "max_grid_points": 1000
  }
}
